{
  "$schema": "./skill-index.schema.json",
  "version": "1.0.0",
  "lastUpdated": "2025-12-31",
  "sources": [
    {
      "id": "anthropics-skills",
      "name": "Anthropic Skills (Official)",
      "owner": "anthropics",
      "url": "https://github.com/anthropics/skills",
      "type": "official",
      "description": "Anthropic 公式の Claude Skills リポジトリ"
    },
    {
      "id": "github-awesome-copilot",
      "name": "GitHub Awesome Copilot (Official)",
      "owner": "github",
      "url": "https://github.com/github/awesome-copilot",
      "type": "official",
      "description": "GitHub 公式の Copilot リソース集"
    },
    {
      "id": "obra-superpowers",
      "name": "Superpowers",
      "owner": "obra",
      "url": "https://github.com/obra/superpowers",
      "type": "community",
      "description": "高品質なスキル・エージェント・コマンド集"
    },
    {
      "id": "composio-awesome",
      "name": "Awesome Claude Skills (ComposioHQ)",
      "owner": "ComposioHQ",
      "url": "https://github.com/ComposioHQ/awesome-claude-skills",
      "type": "awesome-list",
      "description": "Claude Skills のキュレーションリスト"
    },
    {
      "id": "claude-scientific-skills",
      "name": "Claude Scientific Skills",
      "owner": "K-Dense-AI",
      "url": "https://github.com/K-Dense-AI/claude-scientific-skills",
      "type": "community",
      "description": "科学研究向けスキル集（論文、ポスター、スライド作成）"
    },
    {
      "id": "playwright-skill",
      "name": "Playwright Skill",
      "owner": "lackeyjb",
      "url": "https://github.com/lackeyjb/playwright-skill",
      "type": "community",
      "description": "Playwright によるブラウザ自動化・テスト実行"
    },
    {
      "id": "aktsmm-agent-skills",
      "name": "Agent Skills (aktsmm)",
      "owner": "aktsmm",
      "url": "https://github.com/aktsmm/Agent-Skills",
      "type": "community",
      "description": "Azure・開発系スキル by yamapan"
    },
    {
      "id": "openshift-ai-helpers",
      "name": "OpenShift AI Helpers",
      "owner": "openshift-eng",
      "url": "https://github.com/openshift-eng/ai-helpers",
      "type": "community",
      "description": "HyperShift クラスタ作成スキル (AWS/Azure/KubeVirt/OpenStack/PowerVS)"
    },
    {
      "id": "claude-codex-settings",
      "name": "Claude Codex Settings",
      "owner": "fcakyon",
      "url": "https://github.com/fcakyon/claude-codex-settings",
      "type": "community",
      "description": "Azure/GCloud/Slack/MongoDB 等の各種ツール設定スキル"
    },
    {
      "id": "claude-command-control",
      "name": "Claude Command & Control",
      "owner": "enuno",
      "url": "https://github.com/enuno/claude-command-and-control",
      "type": "community",
      "description": "並列エージェント実行・通信・ワークフロー管理スキル集"
    },
    {
      "id": "claude-plugins-plus",
      "name": "Claude Code Plugins Plus Skills",
      "owner": "jeremylongshore",
      "url": "https://github.com/jeremylongshore/claude-code-plugins-plus-skills",
      "type": "community",
      "description": "AI SDK v5 マルチエージェントシステム構築スキル"
    },
    {
      "id": "claude-code-harness",
      "name": "Claude Code Harness",
      "owner": "Chachamaru127",
      "url": "https://github.com/Chachamaru127/claude-code-harness",
      "type": "community",
      "description": "自律的 Plan→Work→Review サイクルで高品質開発を実現"
    },
    {
      "id": "personal-ai-infra",
      "name": "Personal AI Infrastructure",
      "owner": "danielmiessler",
      "url": "https://github.com/danielmiessler/Personal_AI_Infrastructure",
      "type": "community",
      "description": "AI インフラ・オブザーバビリティスキル by danielmiessler"
    }
  ],
  "skills": [
    {
      "name": "algorithmic-art",
      "source": "anthropics-skills",
      "path": "skills/algorithmic-art",
      "categories": ["creative", "art"],
      "description": "アルゴリズミックアートの生成"
    },
    {
      "name": "brand-guidelines",
      "source": "anthropics-skills",
      "path": "skills/brand-guidelines",
      "categories": ["design", "branding"],
      "description": "ブランドガイドラインの作成・管理"
    },
    {
      "name": "canvas-design",
      "source": "anthropics-skills",
      "path": "skills/canvas-design",
      "categories": ["design", "creative"],
      "description": "キャンバスデザインの作成"
    },
    {
      "name": "doc-coauthoring",
      "source": "anthropics-skills",
      "path": "skills/doc-coauthoring",
      "categories": ["document", "collaboration"],
      "description": "ドキュメントの共同執筆"
    },
    {
      "name": "docx",
      "source": "anthropics-skills",
      "path": "skills/docx",
      "categories": ["document", "office"],
      "description": "Word ドキュメント (.docx) の処理"
    },
    {
      "name": "pdf",
      "source": "anthropics-skills",
      "path": "skills/pdf",
      "categories": ["document"],
      "description": "PDF ファイルの処理"
    },
    {
      "name": "pptx",
      "source": "anthropics-skills",
      "path": "skills/pptx",
      "categories": ["document", "office", "presentation"],
      "description": "PowerPoint (.pptx) の処理"
    },
    {
      "name": "xlsx",
      "source": "anthropics-skills",
      "path": "skills/xlsx",
      "categories": ["document", "office", "data"],
      "description": "Excel (.xlsx) の処理"
    },
    {
      "name": "frontend-design",
      "source": "anthropics-skills",
      "path": "skills/frontend-design",
      "categories": ["web", "design", "frontend"],
      "description": "フロントエンドデザインの作成"
    },
    {
      "name": "web-artifacts-builder",
      "source": "anthropics-skills",
      "path": "skills/web-artifacts-builder",
      "categories": ["web", "frontend"],
      "description": "Web アーティファクトのビルド"
    },
    {
      "name": "webapp-testing",
      "source": "anthropics-skills",
      "path": "skills/webapp-testing",
      "categories": ["web", "testing"],
      "description": "Web アプリケーションのテスト"
    },
    {
      "name": "mcp-builder",
      "source": "anthropics-skills",
      "path": "skills/mcp-builder",
      "categories": ["mcp", "development"],
      "description": "MCP サーバーの構築"
    },
    {
      "name": "skill-creator",
      "source": "anthropics-skills",
      "path": "skills/skill-creator",
      "categories": ["meta", "development"],
      "description": "新しいスキルの作成ガイド"
    },
    {
      "name": "slack-gif-creator",
      "source": "anthropics-skills",
      "path": "skills/slack-gif-creator",
      "categories": ["creative", "communication"],
      "description": "Slack 用 GIF の作成"
    },
    {
      "name": "theme-factory",
      "source": "anthropics-skills",
      "path": "skills/theme-factory",
      "categories": ["design", "theming"],
      "description": "テーマの作成"
    },
    {
      "name": "internal-comms",
      "source": "anthropics-skills",
      "path": "skills/internal-comms",
      "categories": ["communication", "business"],
      "description": "社内コミュニケーション"
    },
    {
      "name": "brainstorming",
      "source": "obra-superpowers",
      "path": "skills/brainstorming",
      "categories": ["planning", "ideation"],
      "description": "ブレインストーミングの実施"
    },
    {
      "name": "writing-plans",
      "source": "obra-superpowers",
      "path": "skills/writing-plans",
      "categories": ["planning", "documentation"],
      "description": "計画書の作成"
    },
    {
      "name": "executing-plans",
      "source": "obra-superpowers",
      "path": "skills/executing-plans",
      "categories": ["planning", "execution"],
      "description": "計画の実行"
    },
    {
      "name": "test-driven-development",
      "source": "obra-superpowers",
      "path": "skills/test-driven-development",
      "categories": ["development", "testing", "tdd"],
      "description": "テスト駆動開発 (TDD)"
    },
    {
      "name": "systematic-debugging",
      "source": "obra-superpowers",
      "path": "skills/systematic-debugging",
      "categories": ["development", "debugging"],
      "description": "体系的なデバッグ手法"
    },
    {
      "name": "subagent-driven-development",
      "source": "obra-superpowers",
      "path": "skills/subagent-driven-development",
      "categories": ["development", "agents"],
      "description": "サブエージェント駆動開発"
    },
    {
      "name": "dispatching-parallel-agents",
      "source": "obra-superpowers",
      "path": "skills/dispatching-parallel-agents",
      "categories": ["development", "agents", "parallel"],
      "description": "並列エージェントのディスパッチ"
    },
    {
      "name": "using-git-worktrees",
      "source": "obra-superpowers",
      "path": "skills/using-git-worktrees",
      "categories": ["git", "development"],
      "description": "Git worktree の活用"
    },
    {
      "name": "receiving-code-review",
      "source": "obra-superpowers",
      "path": "skills/receiving-code-review",
      "categories": ["git", "code-review"],
      "description": "コードレビューの受け取り方"
    },
    {
      "name": "requesting-code-review",
      "source": "obra-superpowers",
      "path": "skills/requesting-code-review",
      "categories": ["git", "code-review"],
      "description": "コードレビューのリクエスト"
    },
    {
      "name": "finishing-a-development-branch",
      "source": "obra-superpowers",
      "path": "skills/finishing-a-development-branch",
      "categories": ["git", "development"],
      "description": "開発ブランチの完了処理"
    },
    {
      "name": "verification-before-completion",
      "source": "obra-superpowers",
      "path": "skills/verification-before-completion",
      "categories": ["quality", "verification"],
      "description": "完了前の検証"
    },
    {
      "name": "writing-skills",
      "source": "obra-superpowers",
      "path": "skills/writing-skills",
      "categories": ["meta", "development"],
      "description": "スキルの書き方"
    },
    {
      "name": "using-superpowers",
      "source": "obra-superpowers",
      "path": "skills/using-superpowers",
      "categories": ["meta"],
      "description": "Superpowers の使い方"
    },
    {
      "name": "artifacts-builder",
      "source": "composio-awesome",
      "path": "artifacts-builder",
      "categories": ["web", "frontend"],
      "description": "アーティファクトビルダー"